reviewId,paperId,reviewText,reviewDecision,reviewDecisionBoolean,paperTitle
r1794,p1794,Review content,accepted,1,Graph Theory in Practice: Part II
r1795,p1795,Review content,accepted,1,Graph theory in network analysis
r1796,p1796,Review content,rejected,0,Algebraic Graph Theory: The multiplicative expansion
r1797,p1797,Review content,accepted,1,An Application of Graph Theory to Additive Number Theory
r1798,p1798,Review content,accepted,1,Fractional Graph Theory
r1799,p1799,Review content,accepted,1,Three short proofs in graph theory
r1800,p1800,Review content,accepted,1,GRAPH THEORY IN PRACTICE : PART I
r1801,p1801,Review content,accepted,1,"Affordances. Motivations, and the World Graph Theory"
r1802,p1802,Review content,accepted,1,Graph theory and applications
r1803,p1803,Review content,accepted,1,Three short proofs in graph theory
r1804,p1804,Review content,accepted,1,Graph theory in network analysis
r1805,p1805,Review content,accepted,1,Graph theory and Feynman integrals
r1806,p1806,Review content,accepted,1,Some Applications of Graph Theory to the Structural Analysis of Mechanisms
r1807,p1807,Review content,accepted,1,From time series to complex networks: The visibility graph
r1808,p1808,Review content,accepted,1,On a Connection of Number Theory with Graph Theory
r1809,p1809,Review content,accepted,1,Discrete Mathematics With Graph Theory
r1810,p1810,Review content,accepted,1,On a Problem in Graph Theory
r1811,p1811,Review content,accepted,1,Graph theory
r1812,p1812,Review content,rejected,0,Some problems in graph theory
r1813,p1813,Review content,accepted,1,The Many Facets of Graph Theory
r1814,p1814,Review content,accepted,1,Maximizing the total number of spanning trees in a graph: Two related problems in graph theory and optimum design theory
r1815,p1815,Review content,accepted,1,An Extremal Problem for Sets with Applications to Graph Theory
r1816,p1816,Review content,accepted,1,Graph Theory As A Mathematical Model In Social Science
r1817,p1817,Review content,accepted,1,SOME ODD GRAPH THEORY
r1818,p1818,Review content,accepted,1,Applied graph theory: Graphs and electrical networks
r1819,p1819,Review content,accepted,1,Graph theory and Gaussian elimination.
r1820,p1820,Review content,accepted,1,Applications of graph theory algorithms
r1821,p1821,Review content,accepted,1,Graph Theory and Algorithms
r1822,p1822,Review content,accepted,1,On a valence problem in extremal graph theory
r1823,p1823,Review content,rejected,0,Extremal graph theory with emphasis on probabilistic methods
r1824,p1824,Review content,accepted,1,Graph theory and related topics
r1825,p1825,Review content,accepted,1,Computational chemical graph theory
r1826,p1826,Review content,accepted,1,Extremal problems in graph theory
r1827,p1827,Review content,accepted,1,Graph theory and computing
r1828,p1828,Review content,accepted,1,Applications of Graph Theory to Group Structure.
r1829,p1829,Review content,accepted,1,"Graph theory, coding theory, and block designs"
r1830,p1830,Review content,accepted,1,Applications of graph theory
r1831,p1831,Review content,accepted,1,Proof Techniques in Graph Theory
r1832,p1832,Review content,accepted,1,Graph theory and molecular orbitals
r1833,p1833,Review content,accepted,1,Graph Theory and Topology in Chemistry
r1834,p1834,Review content,accepted,1,Progress in Graph Theory
r1835,p1835,Review content,accepted,1,Algebraic methods in graph theory
r1836,p1836,Review content,accepted,1,Graph theory in modern engineering
r1837,p1837,Review content,accepted,1,Topics in graph theory
r1838,p1838,Review content,accepted,1,Foundations of Chemical Reaction Network Theory
r1839,p1839,Review content,accepted,1,LANDSCAPE CONNECTIVITY: A GRAPH‐THEORETIC PERSPECTIVE
r1840,p1840,Review content,rejected,0,Graph theory
r1841,p1841,Review content,accepted,1,An Introduction to the Theory of Graph Spectra: References
r1842,p1842,Review content,accepted,1,Graph Structure and Monadic Second-Order Logic - A Language-Theoretic Approach
r1843,p1843,Review content,rejected,0,"The core decomposition of networks: theory, algorithms and applications"
r1844,p1844,Review content,accepted,1,Supereulerian graphs and the Petersen graph
r1845,p1845,Review content,accepted,1,Guidelines for a graph-theoretic implementation of structural equation modeling
r1846,p1846,Review content,accepted,1,Graph theoretical analysis of magnetoencephalographic functional connectivity in Alzheimer's disease.
r1847,p1847,Review content,accepted,1,Theory and Applications
r1848,p1848,Review content,accepted,1,Subgraph frequencies: mapping the empirical and extremal geography of large graph collections
r1849,p1849,Review content,accepted,1,Large Networks and Graph Limits
r1850,p1850,Review content,accepted,1,Graph Spectra for Complex Networks
r1851,p1851,Review content,rejected,0,Riemann–Roch and Abel–Jacobi theory on a finite graph
r1852,p1852,Review content,accepted,1,Connectedness Index of uncertain Graph
r1853,p1853,Review content,accepted,1,Topological Graph Polynomials in Colored Group Field Theory
r1854,p1854,Review content,accepted,1,"Data clustering - theory, algorithms, and applications"
r1855,p1855,Review content,accepted,1,Spectra of Graphs: Theory and Applications
r1856,p1856,Review content,accepted,1,Theory of didactical situations in mathematics
r1857,p1857,Review content,rejected,0,New Integrable 4D Quantum Field Theories from Strongly Deformed Planar N=4 Supersymmetric Yang-Mills Theory.
r1858,p1858,Review content,accepted,1,Graph theoretical analysis of complex networks in the brain
r1859,p1859,Review content,accepted,1,Graph Algorithms in the Language of Linear Algebra
r1860,p1860,Review content,accepted,1,Open problems in the spectral theory of signed graphs
r1861,p1861,Review content,accepted,1,TOPICS IN GEOMETRIC GROUP THEORY
r1862,p1862,Review content,accepted,1,Introduction to Coding Theory
r1863,p1863,Review content,rejected,0,Image Processing and Analysis With Graphs: theory and Practice
r1864,p1864,Review content,accepted,1,Nonstable K-theory for Graph Algebras
r1865,p1865,Review content,accepted,1,Some Recent Progress and Applications in Graph Minor Theory
r1866,p1866,Review content,accepted,1,A theory of graph comprehension.
r1867,p1867,Review content,accepted,1,Introduction to the Algebraic Theory of Graph Grammars (A Survey)
r1868,p1868,Review content,accepted,1,Coalitional game theory for communication networks
r1869,p1869,Review content,accepted,1,"Algorithmic graph minor theory: Decomposition, approximation, and coloring"
r1870,p1870,Review content,rejected,0,Graph-theoretic connectivity control of mobile robot networks
r1871,p1871,Review content,accepted,1,Graph Minor Theory
r1872,p1872,Review content,accepted,1,Fundamental Theory for Typed Attributed Graph Transformation
r1873,p1873,Review content,accepted,1,Estimating and understanding exponential random graph models
r1874,p1874,Review content,accepted,1,Term graph rewriting: theory and practice
r1875,p1875,Review content,accepted,1,"Graphical Perception: Theory, Experimentation, and Application to the Development of Graphical Methods"
r1876,p1876,Review content,accepted,1,Graph-theoretic methods in database theory
r1877,p1877,Review content,accepted,1,An algebraic theory of graph reduction
r1878,p1878,Review content,accepted,1,Convolutional Neural Networks on Graphs with Fast Localized Spectral Filtering
r1879,p1879,Review content,rejected,0,The Structure of Complex Networks: Theory and Applications
r1880,p1880,Review content,accepted,1,Graph Degree Linkage: Agglomerative Clustering on a Directed Graph
r1881,p1881,Review content,accepted,1,The Gewirtz Graph: An Exercise in the Theory of Graph Spectra
r1882,p1882,Review content,accepted,1,Graph- Theoretical Approaches to the Theory of Voting*
r1883,p1883,Review content,accepted,1,Graph models of habitat mosaics.
r1884,p1884,Review content,accepted,1,Information Theory and Network Coding
r1885,p1885,Review content,accepted,1,"MaxQuant enables high peptide identification rates, individualized p.p.b.-range mass accuracies and proteome-wide protein quantification"
r1886,p1886,Review content,accepted,1,Graph Ramsey theory and the polynomial hierarchy
r1887,p1887,Review content,accepted,1,A Spectral Graph Uncertainty Principle
r1888,p1888,Review content,accepted,1,Multibond graph elements in physical systems theory
r1889,p1889,Review content,accepted,1,Statistical mechanics of complex networks
r1890,p1890,Review content,accepted,1,Stochastic blockmodel approximation of a graphon: Theory and consistent estimation
r1891,p1891,Review content,rejected,0,Consensus and Cooperation in Networked Multi-Agent Systems
r1892,p1892,Review content,accepted,1,On the algebraic theory of graph colorings
r1893,p1893,Review content,rejected,0,A Complexity Measure
r1894,p1894,Review content,rejected,0,Parallel and Distributed Computation: Numerical Methods
r1895,p1895,Review content,rejected,0,Semi-Supervised Learning Using Gaussian Fields and Harmonic Functions
r1896,p1896,Review content,accepted,1,A homology theory for spanning tress of a graph
r1897,p1897,Review content,rejected,0,Spectral sparsification of graphs: theory and algorithms
r1898,p1898,Review content,accepted,1,Graph-based Natural Language Processing and Information Retrieval
r1899,p1899,Review content,accepted,1,The theory of the monetary circuit
r1900,p1900,Review content,accepted,1,Information flow and cooperative control of vehicle formations
r1901,p1901,Review content,accepted,1,Spectra of graphs : theory and application
r1902,p1902,Review content,accepted,1,BrainNet Viewer: A Network Visualization Tool for Human Brain Connectomics
r1903,p1903,Review content,accepted,1,Automated planning - theory and practice
r1904,p1904,Review content,accepted,1,"Functional Analysis, Sobolev Spaces and Partial Differential Equations"
r1905,p1905,Review content,accepted,1,Applications of Hyperstructure Theory
r1906,p1906,Review content,accepted,1,Computing topological parameters of biological networks
r1907,p1907,Review content,accepted,1,On maximizing the second smallest eigenvalue of a state-dependent graph Laplacian
r1908,p1908,Review content,rejected,0,Evolutionary Dynamics: Exploring the Equations of Life
r1909,p1909,Review content,accepted,1,Nonlocal Operators with Applications to Image Processing
r1910,p1910,Review content,accepted,1,Large Networks and Graph Limits
r1911,p1911,Review content,accepted,1,"Mean Curvature, Threshold Dynamics, and Phase Field Theory on Finite Graphs"
r1912,p1912,Review content,accepted,1,Spectra of Graphs
r1913,p1913,Review content,rejected,0,A Formal Basis for the Heuristic Determination of Minimum Cost Paths
r1914,p1914,Review content,accepted,1,Social Network Analysis
r1915,p1915,Review content,accepted,1,An Introduction to Hydrogen Bonding
r1916,p1916,Review content,accepted,1,Random graphs with arbitrary degree distributions and their applications.
r1917,p1917,Review content,accepted,1,Consensus Problems on Networks With Antagonistic Interactions
r1918,p1918,Review content,accepted,1,Wiener Index of Trees: Theory and Applications
r1919,p1919,Review content,accepted,1,The knowledge complexity of interactive proof-systems
r1920,p1920,Review content,accepted,1,"The Dynamics of Message Passing on Dense Graphs, with Applications to Compressed Sensing"
r1921,p1921,Review content,accepted,1,Geometry of cuts and metrics
r1922,p1922,Review content,accepted,1,Geometric Algorithms and Combinatorial Optimization
r1923,p1923,Review content,accepted,1,Brain graphs: graphical models of the human brain connectome.
r1924,p1924,Review content,rejected,0,The small world of the cerebral cortex
r1925,p1925,Review content,rejected,0,Random Walks for Image Segmentation
r1926,p1926,Review content,accepted,1,Challenges with graph interpretation: a review of the literature
r1927,p1927,Review content,accepted,1,Stability of multiagent systems with time-dependent communication links
r1928,p1928,Review content,rejected,0,Rigid graph control architectures for autonomous formations
r1929,p1929,Review content,accepted,1,Constructing free-energy approximations and generalized belief propagation algorithms
r1930,p1930,Review content,rejected,0,Frequency assignment: Theory and applications
r1931,p1931,Review content,accepted,1,Static scheduling algorithms for allocating directed task graphs to multiprocessors
r1932,p1932,Review content,accepted,1,Second-Order Consensus for Multiagent Systems With Directed Topologies and Nonlinear Dynamics
r1933,p1933,Review content,rejected,0,Shock Waves on the Highway
r1934,p1934,Review content,accepted,1,The rainbow connection of a graph is (at most) reciprocal to its minimum degree
r1935,p1935,Review content,rejected,0,Topological quantum chemistry
r1936,p1936,Review content,accepted,1,A Theory of Graphs
r1937,p1937,Review content,rejected,0,Modeling and control of formations of nonholonomic mobile robots
r1938,p1938,Review content,accepted,1,Spectral redemption in clustering sparse networks
r1939,p1939,Review content,accepted,1,"ergm: A Package to Fit, Simulate and Diagnose Exponential-Family Models for Networks."
r1940,p1940,Review content,accepted,1,Big Data Analysis with Signal Processing on Graphs: Representation and processing of massive data sets with irregular structure
r1941,p1941,Review content,accepted,1,KEGGgraph: a graph approach to KEGG PATHWAY in R and bioconductor
r1942,p1942,Review content,accepted,1,Introduction to Quantum Graphs
r1943,p1943,Review content,accepted,1,Kron Reduction of Graphs With Applications to Electrical Networks
r1944,p1944,Review content,accepted,1,A Theory of Network Localization
r1945,p1945,Review content,accepted,1,GRAPH LIMITS AND EXCHANGEABLE RANDOM GRAPHS
r1946,p1946,Review content,rejected,0,Graph-based Knowledge Representation - Computational Foundations of Conceptual Graphs
r1947,p1947,Review content,accepted,1,"Towards a Theory of Scale-Free Graphs: Definition, Properties, and Implications"
r1948,p1948,Review content,accepted,1,"Sharp thresholds of graph properties, and the -sat problem"
r1949,p1949,Review content,accepted,1,Mathematical Concepts in Organic Chemistry
r1950,p1950,Review content,accepted,1,Automatic segmentation of seven retinal layers in SDOCT images congruent with expert manual segmentation
r1951,p1951,Review content,accepted,1,A graph-theoretic approach to the method of global Lyapunov functions
r1952,p1952,Review content,rejected,0,Topological properties of hypercubes
r1953,p1953,Review content,accepted,1,Property testing and its connection to learning and approximation
r1954,p1954,Review content,accepted,1,Resistance distance
r1955,p1955,Review content,rejected,0,Renormalization in Quantum Field Theory and the Riemann–Hilbert Problem I: The Hopf Algebra Structure of Graphs and the Main Theorem
r1956,p1956,Review content,accepted,1,The average distances in random graphs with given expected degrees
r1957,p1957,Review content,accepted,1,Complex Graphs and Networks
r1958,p1958,Review content,accepted,1,An Improved Spectral Graph Partitioning Algorithm for Mapping Parallel Computations
r1959,p1959,Review content,accepted,1,A New Theory of Deadlock-Free Adaptive Routing in Wormhole Networks
r1960,p1960,Review content,accepted,1,Handbook of Combinatorics
r1961,p1961,Review content,accepted,1,Shock Graphs and Shape Matching
r1962,p1962,Review content,accepted,1,Topological index based on the ratios of geometrical and arithmetical means of end-vertex degrees of edges
r1963,p1963,Review content,accepted,1,Algebraic Approaches to Graph Transformation - Part I: Basic Concepts and Double Pushout Approach
r1964,p1964,Review content,accepted,1,Consensus Conditions of Multi-Agent Systems With Time-Varying Topologies and Stochastic Communication Noises
r1965,p1965,Review content,rejected,0,Graphical Models for Game Theory
r1966,p1966,Review content,rejected,0,Mathematics of networks
r1967,p1967,Review content,accepted,1,"The image foresting transform: theory, algorithms, and applications"
r1968,p1968,Review content,accepted,1,Applications of Combinatorial Matrix Theory to Laplacian Matrices of Graphs
r1969,p1969,Review content,accepted,1,Strategic Interaction and Networks
r1970,p1970,Review content,accepted,1,"Two’s company, three (or more) is a simplex"
r1971,p1971,Review content,accepted,1,On Communicating Finite-State Machines
r1972,p1972,Review content,rejected,0,Graph embedding: a general framework for dimensionality reduction
r1973,p1973,Review content,accepted,1,Entanglement in Graph States and its Applications
r1974,p1974,Review content,accepted,1,Combinatorial Algebraic Topology
r1975,p1975,Review content,accepted,1,A Contribution to the Theory of Chromatic Polynomials
r1976,p1976,Review content,accepted,1,"Towards a spectral theory of graphs based on the signless Laplacian, I"
r1977,p1977,Review content,accepted,1,Semi-supervised learning with graphs
r1978,p1978,Review content,rejected,0,"Protein-to-protein interactions: Technologies, databases, and algorithms"
r1979,p1979,Review content,accepted,1,Ramanujan Graphs
r1980,p1980,Review content,accepted,1,Statistical ranking and combinatorial Hodge theory
r1981,p1981,Review content,accepted,1,The topology of multidimensional potential energy surfaces: Theory and application to peptide structure and kinetics
r1982,p1982,Review content,accepted,1,Incidence matrices and interval graphs
r1983,p1983,Review content,accepted,1,Workshop on Algorithms and Models for the Web Graph
r1984,p1984,Review content,accepted,1,Differential and Integral Inequalities
r1985,p1985,Review content,accepted,1,Thermodynamic perturbation theory of polymerization
r1986,p1986,Review content,accepted,1,Every monotone graph property has a sharp threshold
r1987,p1987,Review content,accepted,1,Geometric Group Theory
r1988,p1988,Review content,accepted,1,Koszul duality for Operads
r1989,p1989,Review content,accepted,1,A Best Possible Heuristic for the k-Center Problem
r1990,p1990,Review content,rejected,0,On higher rank graph C ∗ -algebras
r1991,p1991,Review content,accepted,1,"Instantons on ALE spaces, quiver varieties, and Kac-Moody algebras"
r1992,p1992,Review content,rejected,0,First Course on Fuzzy Theory and Applications
r1993,p1993,Review content,rejected,0,Computational Invariant Theory
r1994,p1994,Review content,accepted,1,The Average Distance in a Random Graph with Given Expected Degrees
r1995,p1995,Review content,accepted,1,How to Draw a Graph
r1996,p1996,Review content,accepted,1,I-path analysis
r1997,p1997,Review content,accepted,1,"Sparsity - Graphs, Structures, and Algorithms"
r1998,p1998,Review content,accepted,1,A course on the Web graph
r1999,p1999,Review content,rejected,0,Network theory of microscopic and macroscopic behavior of master equation systems
r2000,p2000,Review content,accepted,1,The Cambridge Structural Database
r2001,p2001,Review content,rejected,0,The PRIDE database and related tools and resources in 2019: improving support for quantification data
r2002,p2002,Review content,accepted,1,"MIMIC-III, a freely accessible critical care database"
r2003,p2003,Review content,rejected,0,Database resources of the National Center for Biotechnology Information
r2004,p2004,Review content,accepted,1,DrugBank 5.0: a major update to the DrugBank database for 2018
r2005,p2005,Review content,accepted,1,"The STRING database in 2017: quality-controlled protein–protein association networks, made broadly accessible"
r2006,p2006,Review content,accepted,1,Introducing EzBioCloud: a taxonomically united database of 16S rRNA gene sequences and whole-genome assemblies
r2007,p2007,Review content,accepted,1,The Pfam protein families database: towards a more sustainable future
r2008,p2008,Review content,accepted,1,Pfam: the protein families database
r2009,p2009,Review content,accepted,1,The SILVA ribosomal RNA gene database project: improved data processing and web-based tools
r2010,p2010,Review content,accepted,1,The Molecular Signatures Database Hallmark Gene Set Collection
r2011,p2011,Review content,accepted,1,The Pfam protein families database in 2019
r2012,p2012,Review content,accepted,1,ImageNet: A large-scale hierarchical image database
r2013,p2013,Review content,accepted,1,Gapped BLAST and PSI-BLAST: a new generation of protein database search programs.
r2014,p2014,Review content,accepted,1,The carbohydrate-active enzymes database (CAZy) in 2013
r2015,p2015,Review content,accepted,1,Places: A 10 Million Image Database for Scene Recognition
r2016,p2016,Review content,accepted,1,Introducing EzTaxon-e: a prokaryotic 16S rRNA gene sequence database with phylotypes that represent uncultured species.
r2017,p2017,Review content,rejected,0,Pfam: The protein families database in 2021
r2018,p2018,Review content,accepted,1,"Reference sequence (RefSeq) database at NCBI: current status, taxonomic expansion, and functional annotation"
r2019,p2019,Review content,accepted,1,WordNet : an electronic lexical database
r2020,p2020,Review content,accepted,1,WordNet: A Lexical Database for English
r2021,p2021,Review content,rejected,0,GTDB-Tk: a toolkit to classify genomes with the Genome Taxonomy Database
r2022,p2022,Review content,accepted,1,HMDB 4.0: the human metabolome database for 2018
r2023,p2023,Review content,accepted,1,A global database of COVID-19 vaccinations
r2024,p2024,Review content,accepted,1,2016 update of the PRIDE database and its related tools
r2025,p2025,Review content,accepted,1,Labeled Faces in the Wild: A Database forStudying Face Recognition in Unconstrained Environments
r2026,p2026,Review content,accepted,1,CARD 2020: antibiotic resistome surveillance with the comprehensive antibiotic resistance database
r2027,p2027,Review content,accepted,1,The Cambridge Structural Database: a quarter of a million crystal structures and rising.
r2028,p2028,Review content,accepted,1,"Greengenes, a Chimera-Checked 16S rRNA Gene Database and Workbench Compatible with ARB"
r2029,p2029,Review content,accepted,1,CDD/SPARCLE: the conserved domain database in 2020
r2030,p2030,Review content,accepted,1,Freebase: a collaboratively created graph database for structuring human knowledge
r2031,p2031,Review content,accepted,1,The Carbohydrate-Active EnZymes database (CAZy): an expert resource for Glycogenomics
r2032,p2032,Review content,rejected,0,The Ribosomal Database Project: improved alignments and new tools for rRNA analysis
r2033,p2033,Review content,accepted,1,"DAVID: Database for Annotation, Visualization, and Integrated Discovery"
r2034,p2034,Review content,accepted,1,An improved method of constructing a database of monthly climate observations and associated high‐resolution grids
r2035,p2035,Review content,accepted,1,The ecoinvent database version 3 (part I): overview and methodology
r2036,p2036,Review content,accepted,1,The mnist database of handwritten digits
r2037,p2037,Review content,rejected,0,The InterPro protein families and domains database: 20 years on
r2038,p2038,Review content,accepted,1,Empirical statistical model to estimate the accuracy of peptide identifications made by MS/MS and database search.
r2039,p2039,Review content,accepted,1,Ribosomal Database Project: data and tools for high throughput rRNA analysis
r2040,p2040,Review content,accepted,1,The Molecular Signatures Database (MSigDB) hallmark gene set collection.
r2041,p2041,Review content,accepted,1,"The STRING database in 2011: functional interaction networks of proteins, globally integrated and scored"
r2042,p2042,Review content,accepted,1,Learning Deep Features for Scene Recognition using Places Database
r2043,p2043,Review content,accepted,1,SCOP: a structural classification of proteins database for the investigation of sequences and structures.
r2044,p2044,Review content,accepted,1,Molecular signatures database (MSigDB) 3.0
r2045,p2045,Review content,accepted,1,A fast quantum mechanical algorithm for database search
r2046,p2046,Review content,accepted,1,dbSNP: the NCBI database of genetic variation
r2047,p2047,Review content,rejected,0,The COG database: an updated version includes eukaryotes
r2048,p2048,Review content,accepted,1,Introduction to WordNet: An On-line Lexical Database
r2049,p2049,Review content,rejected,0,The Pfam protein families database
r2050,p2050,Review content,accepted,1,The HITRAN 2008 molecular spectroscopic database
r2051,p2051,Review content,accepted,1,"PlantCARE, a database of plant cis-acting regulatory elements and a portal to tools for in silico analysis of promoter sequences"
r2052,p2052,Review content,accepted,1,CDD: NCBI's conserved domain database
r2053,p2053,Review content,accepted,1,HMDB: A large video database for human motion recognition
r2054,p2054,Review content,accepted,1,Fundamentals of Database Systems
r2055,p2055,Review content,accepted,1,The COG database: a tool for genome-scale analysis of protein functions and evolution
r2056,p2056,Review content,accepted,1,TCMSP: a database of systems pharmacology for drug discovery from herbal medicines
r2057,p2057,Review content,accepted,1,"Repbase Update, a database of repetitive elements in eukaryotic genomes"
r2058,p2058,Review content,accepted,1,LabelMe: A Database and Web-Based Tool for Image Annotation
r2059,p2059,Review content,accepted,1,"NCBI reference sequences (RefSeq): a curated non-redundant sequence database of genomes, transcripts and proteins"
r2060,p2060,Review content,rejected,0,CARD 2017: expansion and model-centric curation of the comprehensive antibiotic resistance database
r2061,p2061,Review content,accepted,1,miRDB: an online database for prediction of functional microRNA targets
r2062,p2062,Review content,accepted,1,IPD-IMGT/HLA Database
r2063,p2063,Review content,accepted,1,SUN database: Large-scale scene recognition from abbey to zoo
r2064,p2064,Review content,accepted,1,The AR face database
r2065,p2065,Review content,rejected,0,The ChEMBL database in 2017
r2066,p2066,Review content,accepted,1,Human Protein Reference Database—2009 update
