reviewId,paperId,reviewText,reviewDecision,reviewDecisionBoolean,paperTitle
r525,p525,Review content,accepted,1,Word Embeddings for the Software Engineering Domain
r526,p526,Review content,accepted,1,Introduction to Software Engineering
r527,p527,Review content,accepted,1,Software Engineering for Machine-Learning Applications: The Road Ahead
r528,p528,Review content,accepted,1,A Survey of App Store Analysis for Software Engineering
r529,p529,Review content,accepted,1,Guidelines for including the grey literature and conducting multivocal literature reviews in software engineering
r530,p530,Review content,accepted,1,Software Engineering Challenges of Deep Learning
r531,p531,Review content,accepted,1,Design Science Methodology for Information Systems and Software Engineering
r532,p532,Review content,rejected,0,The History of Software Engineering
r533,p533,Review content,accepted,1,A survey of the use of crowdsourcing in software engineering
r534,p534,Review content,accepted,1,Fundamentals of Software Engineering
r535,p535,Review content,accepted,1,Robust Statistical Methods for Empirical Software Engineering
r536,p536,Review content,accepted,1,Grounded Theory in Software Engineering Research: A Critical Review and Guidelines
r537,p537,Review content,rejected,0,On negative results when using sentiment analysis tools for software engineering research
r538,p538,Review content,rejected,0,Leveraging Automated Sentiment Analysis in Software Engineering
r539,p539,Review content,accepted,1,From Word Embeddings to Document Similarities for Improved Information Retrieval in Software Engineering
r540,p540,Review content,accepted,1,Software Engineering Education: Converging with the Startup Industry
r541,p541,Review content,accepted,1,"Model-Driven Software Engineering in Practice, Second Edition"
r542,p542,Review content,accepted,1,Experimentation in Software Engineering
r543,p543,Review content,rejected,0,Blockchain-Oriented Software Engineering: Challenges and New Directions
r544,p544,Review content,accepted,1,Model-Based Software Engineering to Tame the IoT Jungle
r545,p545,Review content,accepted,1,Key Abstractions for IoT-Oriented Software Engineering
r546,p546,Review content,accepted,1,Cognitive Biases in Software Engineering: A Systematic Mapping Study
r547,p547,Review content,accepted,1,Belief & Evidence in Empirical Software Engineering
r548,p548,Review content,accepted,1,A Map of Threats to Validity of Systematic Literature Reviews in Software Engineering
r549,p549,Review content,accepted,1,An Empirical Study of Practitioners' Perspectives on Green Software Engineering
r550,p550,Review content,accepted,1,On the pragmatic design of literature studies in software engineering: an experience-based guideline
r551,p551,Review content,accepted,1,A framework for gamification in software engineering
r552,p552,Review content,accepted,1,"Crowdsourcing in Software Engineering: Models, Motivations, and Challenges"
r553,p553,Review content,accepted,1,Evidence-Based Software Engineering and Systematic Reviews
r554,p554,Review content,rejected,0,"Speed, Data, and Ecosystems: The Future of Software Engineering"
r555,p555,Review content,accepted,1,Open innovation in software engineering: a systematic mapping study
r556,p556,Review content,accepted,1,The Role of Ethnographic Studies in Empirical Software Engineering
r557,p557,Review content,accepted,1,On the use of many quality attributes for software refactoring: a many-objective search-based software engineering approach
r558,p558,Review content,accepted,1,Crossover Designs in Software Engineering Experiments: Benefits and Perils
r559,p559,Review content,accepted,1,Systems and Software Engineering
r560,p560,Review content,accepted,1,A discipline for software engineering
r561,p561,Review content,accepted,1,Future Trends in Software Engineering Research for Mobile Apps
r562,p562,Review content,accepted,1,Student Experiences Using GitHub in Software Engineering Courses: A Case Study
r563,p563,Review content,accepted,1,Software-Engineering the Internet of Things
r564,p564,Review content,accepted,1,Software Engineering
r565,p565,Review content,accepted,1,Software Engineering Component Based Software Engineering
r566,p566,Review content,rejected,0,Software-Specific Named Entity Recognition in Software Engineering Social Content
r567,p567,Review content,accepted,1,Game development software engineering process life cycle: a systematic review
r568,p568,Review content,accepted,1,Experimentation in Software Engineering
r569,p569,Review content,accepted,1,Modeling in Event-B - System and Software Engineering
r570,p570,Review content,accepted,1,Guide to the Software Engineering Body of Knowledge (SWEBOK(R)): Version 3.0
r571,p571,Review content,rejected,0,Global Software Engineering: Evolution and Trends
r572,p572,Review content,rejected,0,A Hitchhiker's guide to statistical tests for assessing randomized algorithms in software engineering
r573,p573,Review content,rejected,0,ISO / IEC 25010 : 2011 Systems and software engineering — Systems and software Quality Requirements and Evaluation ( SQuaRE ) — System and software quality models
r574,p574,Review content,accepted,1,On Non-Functional Requirements in Software Engineering
r575,p575,Review content,accepted,1,Twenty-eight years of component-based software engineering
r576,p576,Review content,rejected,0,Are Students Representatives of Professionals in Software Engineering Experiments?
r577,p577,Review content,accepted,1,A practical guide to controlled experiments of software engineering tools with human participants
r578,p578,Review content,accepted,1,Docker [Software engineering]
r579,p579,Review content,rejected,0,Towards a decision-making structure for selecting a research design in empirical software engineering
r580,p580,Review content,accepted,1,The “Physics” of Notations: Toward a Scientific Basis for Constructing Visual Notations in Software Engineering
r581,p581,Review content,rejected,0,Gamification in software engineering - A systematic mapping
r582,p582,Review content,accepted,1,Choosing your weapons: On sentiment analysis tools for software engineering research
r583,p583,Review content,accepted,1,Case Study Research in Software Engineering - Guidelines and Examples
r584,p584,Review content,accepted,1,A theory of distances in software engineering
r585,p585,Review content,accepted,1,Views on Internal and External Validity in Empirical Software Engineering
r586,p586,Review content,accepted,1,A systematic review of systematic review process research in software engineering
r587,p587,Review content,accepted,1,Software Engineering: A Practitioners Approach
r588,p588,Review content,accepted,1,Agent-Oriented Software Engineering
r589,p589,Review content,accepted,1,The (R) Evolution of social media in software engineering
r590,p590,Review content,accepted,1,Search based software engineering for software product line engineering: a survey and directions for future work
r591,p591,Review content,accepted,1,Software Engineering Meets Control Theory
r592,p592,Review content,accepted,1,Investigating Country Differences in Mobile App User Behavior and Challenges for Software Engineering
r593,p593,Review content,accepted,1,An empirically based terminology and taxonomy for global software engineering
r594,p594,Review content,accepted,1,Happy software developers solve problems better: psychological measurements in empirical software engineering
r595,p595,Review content,accepted,1,"Software Product Line Engineering - Foundations, Principles, and Techniques"
r596,p596,Review content,accepted,1,Software engineering at the speed of light: how developers stay current using twitter
r597,p597,Review content,accepted,1,Behavioral software engineering: A definition and systematic literature review
r598,p598,Review content,rejected,0,Replication of empirical studies in software engineering research: a systematic mapping study
r599,p599,Review content,accepted,1,Guidelines for Conducting Surveys in Software Engineering
r600,p600,Review content,accepted,1,Eye-Tracking Metrics in Software Engineering
r601,p601,Review content,accepted,1,Systematic mapping study on software engineering for sustainability (SE4S)
r602,p602,Review content,accepted,1,Fundamentals of Software Engineering
r603,p603,Review content,accepted,1,Green in Software Engineering
r604,p604,Review content,accepted,1,Challenges for Software Engineering in Automation
r605,p605,Review content,accepted,1,Search Based Software Engineering
r606,p606,Review content,accepted,1,Replications of software engineering experiments
r607,p607,Review content,accepted,1,Continuous software engineering and beyond: trends and challenges
r608,p608,Review content,rejected,0,Continuous Software Engineering
r609,p609,Review content,accepted,1,Introduction to Green in Software Engineering
r610,p610,Review content,accepted,1,Lessons from applying the systematic literature review process within the software engineering domain
r611,p611,Review content,accepted,1,A Systematic Literature Review on Fault Prediction Performance in Software Engineering
r612,p612,Review content,accepted,1,Continuous Software Engineering: An Introduction
r613,p613,Review content,accepted,1,How to effectively use topic models for software engineering tasks? An approach based on Genetic Algorithms
r614,p614,Review content,accepted,1,Parameter tuning or default values? An empirical investigation in search-based software engineering
r615,p615,Review content,accepted,1,Design patterns: elements of reuseable object-oriented software
r616,p616,Review content,rejected,0,Software Engineering in Industrial Automation: State-of-the-Art Review
r617,p617,Review content,accepted,1,The mythical man-month: Essays on software engineering
r618,p618,Review content,rejected,0,"Search-based software engineering: Trends, techniques and applications"
r619,p619,Review content,accepted,1,On the value of user preferences in search-based software engineering: A case study in software product lines
r620,p620,Review content,accepted,1,Analyze this! 145 questions for data scientists in software engineering
r621,p621,Review content,rejected,0,Automatic query reformulations for text retrieval in software engineering
r622,p622,Review content,accepted,1,Software Engineering for Self-Adaptive Systems II
r623,p623,Review content,rejected,0,Diversity in software engineering research
r624,p624,Review content,accepted,1,"Worldviews, Research Methods, and their Relationship to Validity in Empirical Software Engineering Research"
r625,p625,Review content,accepted,1,Towards a definition of sustainability in and for software engineering
r626,p626,Review content,accepted,1,A Green Model for Sustainable Software Engineering
r627,p627,Review content,accepted,1,Software Engineering Processes for Self-Adaptive Systems
r628,p628,Review content,accepted,1,Organizational social structures for software engineering
r629,p629,Review content,accepted,1,A practical guide for using statistical tests to assess randomized algorithms in software engineering
r630,p630,Review content,accepted,1,Green software engineering with agile methods
r631,p631,Review content,rejected,0,What is social debt in software engineering?
r632,p632,Review content,accepted,1,Systematic literature reviews in software engineering
r633,p633,Review content,accepted,1,Software Engineering for Self-Adaptive Systems: A Research Roadmap
r634,p634,Review content,accepted,1,Agent-based software engineering
r635,p635,Review content,rejected,0,A software engineering perspective on environmental modeling framework design: The Object Modeling System
r636,p636,Review content,accepted,1,Standard Glossary of Software Engineering Terminology
r637,p637,Review content,accepted,1,On the reliability of mapping studies in software engineering
r638,p638,Review content,accepted,1,"Educational software engineering: Where software engineering, education, and gaming meet"
r639,p639,Review content,rejected,0,Preliminary Guidelines for Empirical Research in Software Engineering
r640,p640,Review content,accepted,1,Software Product Line Engineering Foundations Principles And Techniques
r641,p641,Review content,accepted,1,Qualitative Methods in Empirical Studies of Software Engineering
r642,p642,Review content,rejected,0,BEAST 2.5: An advanced software platform for Bayesian evolutionary analysis
r643,p643,Review content,accepted,1,Selecting Empirical Methods for Software Engineering Research
r644,p644,Review content,accepted,1,An open graph visualization system and its applications to software engineering
r645,p645,Review content,accepted,1,Software design
r646,p646,Review content,accepted,1,Global software engineering and agile practices: a systematic review
r647,p647,Review content,accepted,1,Revisions to Software Engineering 2004: Curriculum Guidelines for Undergraduate Degree Programs in Software Engineering
r648,p648,Review content,accepted,1,"What works for whom, where, when, and why? On the role of context in empirical software engineering"
r649,p649,Review content,rejected,0,How to design gamification? A method for engineering gamified software
r650,p650,Review content,accepted,1,Special issue on repeatable results in software engineering prediction
r651,p651,Review content,accepted,1,Dynamic adaptive Search Based Software Engineering
r652,p652,Review content,accepted,1,Where's the Theory for Software Engineering?
r653,p653,Review content,rejected,0,On the dataset shift problem in software engineering prediction models
r654,p654,Review content,accepted,1,The role of Artificial Intelligence in Software Engineering
r655,p655,Review content,accepted,1,Clustering Methodologies for Software Engineering
r656,p656,Review content,rejected,0,Engineering Trustworthy Self-Adaptive Software with Dynamic Assurance Cases
r657,p657,Review content,accepted,1,Object-Oriented Software Engineering
r658,p658,Review content,accepted,1,Embracing the Engineering Side of Software Engineering
r659,p659,Review content,accepted,1,Software Ecosystems: Trends and Impacts on Software Engineering
r660,p660,Review content,accepted,1,Software Engineering Game: Software Engineering Game
r661,p661,Review content,rejected,0,Requirements Engineering - From System Goals to UML Models to Software Specifications
r662,p662,Review content,accepted,1,Systematic literature reviews in software engineering - A tertiary study
r663,p663,Review content,accepted,1,A Process Framework for Global Software Engineering Teams
r664,p664,Review content,rejected,0,On software engineering repositories and their open problems
r665,p665,Review content,accepted,1,Recommended Steps for Thematic Synthesis in Software Engineering
r666,p666,Review content,accepted,1,Software Engineering for Self-Adaptive Systems: A Second Research Roadmap
r667,p667,Review content,rejected,0,The state of the art in end-user software engineering
r668,p668,Review content,accepted,1,Basics of Software Engineering Experimentation
r669,p669,Review content,accepted,1,Software engineering metrics and models
r670,p670,Review content,rejected,0,Traffic engineering in software defined networks
r671,p671,Review content,rejected,0,B4: experience with a globally-deployed software defined wan
r672,p672,Review content,accepted,1,Software product lines - practices and patterns
r673,p673,Review content,accepted,1,Identifying relevant studies in software engineering
r674,p674,Review content,rejected,0,On Parameter Tuning in Search Based Software Engineering
r675,p675,Review content,accepted,1,Human-Centered Software Engineering - Integrating Usability in the Software Development Lifecycle
r676,p676,Review content,accepted,1,Software Product Line Engineering
r677,p677,Review content,accepted,1,Motivation in software engineering: A systematic review update
r678,p678,Review content,accepted,1,A Mapping Study on Requirements Engineering in Agile Software Development
r679,p679,Review content,accepted,1,Ecological inference in empirical software engineering
r680,p680,Review content,accepted,1,Software architecture in practice
r681,p681,Review content,accepted,1,The role of non-exact replications in software engineering experiments
r682,p682,Review content,accepted,1,A Whisper of Evidence in Global Software Engineering
r683,p683,Review content,accepted,1,Toward sustainable software engineering: NIER track
r684,p684,Review content,accepted,1,Research synthesis in software engineering: A tertiary study
r685,p685,Review content,accepted,1,Software engineering issues for mobile application development
r686,p686,Review content,accepted,1,Six years of systematic literature reviews in software engineering: An updated tertiary study
r687,p687,Review content,accepted,1,Requirements Engineering: Foundation for Software Quality
r688,p688,Review content,accepted,1,Bridging metamodels and ontologies in software engineering
r689,p689,Review content,accepted,1,Software engineering / Ian Sommerville.
r690,p690,Review content,rejected,0,A Methodology for Collecting Valid Software Engineering Data
r691,p691,Review content,accepted,1,Qualitative research in software engineering
r692,p692,Review content,accepted,1,Component-Based Software Engineering
r693,p693,Review content,accepted,1,Software Metrics : A Rigorous and Practical Approach
r694,p694,Review content,accepted,1,Recommendation Systems for Software Engineering
r695,p695,Review content,accepted,1,Empirical evidence in global software engineering: a systematic review
r696,p696,Review content,accepted,1,Software Engineering: A Practitioner's Approach (McGraw-Hill Series in Computer Science)
r697,p697,Review content,accepted,1,Non-Functional Requirements in Software Engineering
r698,p698,Review content,accepted,1,An examination of software engineering work practices
r699,p699,Review content,accepted,1,"Search Based Software Engineering: Techniques, Taxonomy, Tutorial"
r700,p700,Review content,accepted,1,Software Engineering: A Practitioner's Approach (McGraw-Hill Series in Computer Science)
r701,p701,Review content,accepted,1,Non-Functional Requirements in Software Engineering
r702,p702,Review content,rejected,0,An examination of software engineering work practices
r703,p703,Review content,accepted,1,"Search Based Software Engineering: Techniques, Taxonomy, Tutorial"
r704,p704,Review content,rejected,0,"Software Engineering: A Practitioner's Approach, 7Th Edition"
r705,p705,Review content,accepted,1,Ontologies for Software Engineering and Software Technology
r706,p706,Review content,accepted,1,Agile Practices in Global Software Engineering - A Systematic Map
r707,p707,Review content,accepted,1,Validity Threats in Empirical Software Engineering Research - An Initial Survey
r708,p708,Review content,accepted,1,The impact of social media on software engineering practices and tools
r709,p709,Review content,rejected,0,Collaboration Tools for Global Software Engineering
r710,p710,Review content,accepted,1,Managing Software Engineering Knowledge
r711,p711,Review content,accepted,1,A Comparison Between Five Models Of Software Engineering
r712,p712,Review content,rejected,0,Assessing traceability of software engineering artifacts
r713,p713,Review content,rejected,0,Synthesizing evidence in software engineering research
r714,p714,Review content,accepted,1,The Guide to the Software Engineering Body of Knowledge
r715,p715,Review content,accepted,1,Guide to the Software Engineering Body of Knowledge (SWEBOK) and the Software Engineering Education Knowledge (SEEK) - a preliminary mapping
r716,p716,Review content,accepted,1,Validity concerns in software engineering research
r717,p717,Review content,accepted,1,How Reliable Are Systematic Reviews in Empirical Software Engineering?
r718,p718,Review content,accepted,1,Software intelligence: the future of mining software engineering data
r719,p719,Review content,accepted,1,Applying empirical software engineering to software architecture: challenges and lessons learned
r720,p720,Review content,accepted,1,Global Software Engineering: A Software Process Approach
r721,p721,Review content,accepted,1,Collaborative Software Engineering: Challenges and Prospects
r722,p722,Review content,accepted,1,"Softwares Product Lines, Global Development and Ecosystems: Collaboration in Software Engineering"
r723,p723,Review content,rejected,0,Guide to the Software Engineering Body of Knowledge
r724,p724,Review content,accepted,1,Agent-Oriented Software Engineering: The State of the Art
r725,p725,Review content,accepted,1,"Object-Oriented Software Engineering Using UML, Patterns, and Java"
r726,p726,Review content,rejected,0,Curating GitHub for engineered software projects
r727,p727,Review content,accepted,1,Component-Based Software Engineering: Putting the Pieces Together
r728,p728,Review content,accepted,1,Software engineering in an uncertain world
r729,p729,Review content,accepted,1,Evidence-based software engineering
r730,p730,Review content,accepted,1,Social media for software engineering
r731,p731,Review content,accepted,1,On agent-based software engineering
r732,p732,Review content,accepted,1,Software engineering research for computer games: A systematic review
r733,p733,Review content,accepted,1,Handbook of software reliability engineering
r734,p734,Review content,accepted,1,Search Based Software Engineering: A Comprehensive Analysis and Review of Trends Techniques and Applications
r735,p735,Review content,rejected,0,Guide to Advanced Empirical Software Engineering
r736,p736,Review content,accepted,1,Software Engineering for Self-Adaptive Systems [outcome of a Dagstuhl Seminar]
r737,p737,Review content,accepted,1,The mythical man-month - essays on software engineering (2. ed.)
r738,p738,Review content,rejected,0,Data Mining for Software Engineering
r739,p739,Review content,accepted,1,A software engineering approach to ontology building
r740,p740,Review content,rejected,0,"Model-driven software development - technology, engineering, management"
r741,p741,Review content,accepted,1,Software Engineering Challenges in Game Development
r742,p742,Review content,accepted,1,Software Engineering Best Practices
r743,p743,Review content,accepted,1,Systematic literature reviews in software engineering: Preliminary results from interviews with researchers
r744,p744,Review content,accepted,1,"Software Engineering: A Practitionerʼs Approach, 7/e"
r745,p745,Review content,accepted,1,Development of a Software Engineering Ontology for Multisite Software Development
r746,p746,Review content,accepted,1,Action research use in software engineering: An initial survey
r747,p747,Review content,rejected,0,What Do We Know about Knowledge Management? Practical Implications for Software Engineering
r748,p748,Review content,accepted,1,Ontology Classification for Semantic-Web-Based Software Engineering
r749,p749,Review content,accepted,1,Context in industrial software engineering research
r750,p750,Review content,accepted,1,Software Engineering for Spreadsheets
r751,p751,Review content,accepted,1,Global Software Engineering: The Future of Socio-technical Coordination
r752,p752,Review content,accepted,1,"On ""Software engineering"""
r753,p753,Review content,accepted,1,The Current State and Future of Search Based Software Engineering
r754,p754,Review content,accepted,1,Trends in Embedded Software Engineering
r755,p755,Review content,accepted,1,Motivation in Software Engineering: A systematic literature review
r756,p756,Review content,accepted,1,Models of motivation in software engineering
r757,p757,Review content,accepted,1,Experience and Knowledge Management in Software Engineering
r758,p758,Review content,accepted,1,ERP Customization as Software Engineering: Knowledge Sharing and Cooperation
r759,p759,Review content,accepted,1,Context and Adaptivity in Pervasive Computing Environments: Links with Software Engineering and Ontological Engineering
r760,p760,Review content,accepted,1,Using the inverted classroom to teach software engineering
r761,p761,Review content,accepted,1,Sentiment Polarity Detection for Software Development
r762,p762,Review content,accepted,1,Progress on approaches to software defect prediction
r763,p763,Review content,accepted,1,\{PROMISE\} Repository of empirical software engineering data
r764,p764,Review content,rejected,0,Usability engineering
r765,p765,Review content,accepted,1,Managing the software process
r766,p766,Review content,accepted,1,Software agents
r767,p767,Review content,accepted,1,Property-Based Software Engineering Measurement
r768,p768,Review content,accepted,1,Reporting Experiments in Software Engineering
r769,p769,Review content,accepted,1,Using Mapping Studies in Software Engineering
r770,p770,Review content,accepted,1,The role of replications in Empirical Software Engineering
r771,p771,Review content,rejected,0,Building Theories in Software Engineering
r772,p772,Review content,rejected,0,Strength of evidence in systematic reviews in software engineering
r773,p773,Review content,accepted,1,The Rise and Evolution of Agile Software Development
r774,p774,Review content,accepted,1,A survey of controlled experiments in software engineering
r775,p775,Review content,accepted,1,Software engineering: theory and practice
r776,p776,Review content,rejected,0,A Software Engineering Lifecycle Standard for Very Small Enterprises
r777,p777,Review content,accepted,1,08031 -- Software Engineering for Self-Adaptive Systems: A Research Road Map
r778,p778,Review content,accepted,1,A Brief History of Software Engineering
r779,p779,Review content,rejected,0,Problem Oriented Software Engineering: Solving the Package Router Control Problem
r780,p780,Review content,accepted,1,Replication's Role in Software Engineering
r781,p781,Review content,accepted,1,Towards individualized software engineering: empirical studies should collect psychometrics
r782,p782,Review content,accepted,1,A survey of social software engineering
r783,p783,Review content,rejected,0,Metamodelling for software engineering
