reviewId,paperId,reviewText,reviewDecision,reviewDecisionBoolean,paperTitle
r1045,p1045,Review content,accepted,1,Impacts of bioinformatics to medicinal chemistry.
r1046,p1046,Review content,accepted,1,Taverna: a tool for the composition and enactment of bioinformatics workflows
r1047,p1047,Review content,rejected,0,Data-driven advice for applying machine learning to bioinformatics problems
r1048,p1048,Review content,rejected,0,Influenza Research Database: An integrated bioinformatics resource for influenza virus research
r1049,p1049,Review content,accepted,1,"Next Generation Sequencing and Bioinformatics Methodologies for Infectious Disease Research and Public Health: Approaches, Applications, and Considerations for Development of Laboratory Capacity."
r1050,p1050,Review content,rejected,0,Metabolomics technology and bioinformatics for precision medicine
r1051,p1051,Review content,accepted,1,A brief history of bioinformatics
r1052,p1052,Review content,accepted,1,A novel features ranking metric with application to scalable visual and bioinformatics data classification
r1053,p1053,Review content,accepted,1,An overview of topic modeling and its current applications in bioinformatics
r1054,p1054,Review content,accepted,1,Protein Bioinformatics Databases and Resources.
r1055,p1055,Review content,accepted,1,A comparison of sequencing platforms and bioinformatics pipelines for compositional analysis of the gut microbiome
r1056,p1056,Review content,accepted,1,Manual for Using Homomorphic Encryption for Bioinformatics
r1057,p1057,Review content,rejected,0,A Review of Bioinformatics Tools for Bio-Prospecting from Metagenomic Sequence Data
r1058,p1058,Review content,accepted,1,A cloud-compatible bioinformatics pipeline for ultrarapid pathogen identification from next-generation sequencing of clinical samples
r1059,p1059,Review content,accepted,1,Performance measures in evaluating machine learning based bioinformatics predictors for classifications
r1060,p1060,Review content,accepted,1,Encyclopedia of Bioinformatics and Computational Biology: ABC of Bioinformatics
r1061,p1061,Review content,accepted,1,Bioinformatics and peptidomics approaches to the discovery and analysis of food-derived bioactive peptides
r1062,p1062,Review content,accepted,1,A novel hierarchical selective ensemble classifier with bioinformatics application
r1063,p1063,Review content,accepted,1,CLIMB (the Cloud Infrastructure for Microbial Bioinformatics): an online resource for the medical microbiology community
r1064,p1064,Review content,accepted,1,An overview of bioinformatics tools for epitope prediction: Implications on vaccine development
r1065,p1065,Review content,accepted,1,Snakemake - a scalable bioinformatics workflow engine
r1066,p1066,Review content,accepted,1,Network Inference and Reconstruction in Bioinformatics
r1067,p1067,Review content,accepted,1,Text Mining for Bioinformatics Using Biomedical Literature
r1068,p1068,Review content,accepted,1,A global perspective on evolving bioinformatics and data science training needs
r1069,p1069,Review content,rejected,0,The Road to Metagenomics: From Microbiology to DNA Sequencing Technologies and Bioinformatics
r1070,p1070,Review content,accepted,1,Feature selection methods for big data bioinformatics: A survey from the search perspective.
r1071,p1071,Review content,rejected,0,Bioinformatics research at BGRS-2018
r1072,p1072,Review content,accepted,1,The development and application of bioinformatics core competencies to improve bioinformatics training and education
r1073,p1073,Review content,accepted,1,PipeCraft: Flexible open‐source toolkit for bioinformatics analysis of custom high‐throughput amplicon sequencing data
r1074,p1074,Review content,accepted,1,Aptamer Bioinformatics
r1075,p1075,Review content,rejected,0,Enabling the democratization of the genomics revolution with a fully integrated web-based bioinformatics platform
r1076,p1076,Review content,accepted,1,"H3ABioNet, a sustainable pan-African bioinformatics network for human heredity and health in Africa"
r1077,p1077,Review content,rejected,0,The Impact of Bioinformatics on Vaccine Design and Development
r1078,p1078,Review content,accepted,1,Single-Cell Transcriptomics Bioinformatics and Computational Challenges
r1079,p1079,Review content,accepted,1,Systems Bioinformatics: increasing precision of computational diagnostics and therapeutics through network-based approaches
r1080,p1080,Review content,accepted,1,Bioinformatics core competencies for undergraduate life sciences education
r1081,p1081,Review content,accepted,1,"Review of Current Methods, Applications, and Data Management for the Bioinformatics Analysis of Whole Exome Sequencing"
r1082,p1082,Review content,rejected,0,Bioinformatics applications on Apache Spark
r1083,p1083,Review content,accepted,1,Bioinformatics and Drug Discovery
r1084,p1084,Review content,accepted,1,Designing a course model for distance-based online bioinformatics training in Africa: The H3ABioNet experience
r1085,p1085,Review content,accepted,1,Microarray bioinformatics in cancer- a review.
r1086,p1086,Review content,accepted,1,Bioinformatics for precision oncology
r1087,p1087,Review content,rejected,0,The European Bioinformatics Institute in 2016: Data growth and integration
r1088,p1088,Review content,accepted,1,Reproducible bioinformatics project: a community for reproducible bioinformatics analysis pipelines
r1089,p1089,Review content,accepted,1,Developing reproducible bioinformatics analysis workflows for heterogeneous computing environments to support African genomics
r1090,p1090,Review content,accepted,1,"Bioinformatics approaches, prospects and challenges of food bioactive peptide research"
r1091,p1091,Review content,accepted,1,Metagenomics and Bioinformatics in Microbial Ecology: Current Status and Beyond
r1092,p1092,Review content,accepted,1,Barriers to integration of bioinformatics into undergraduate life sciences education: A national study of US life sciences faculty uncover significant barriers to integrating bioinformatics into undergraduate instruction
r1093,p1093,Review content,rejected,0,Bioinformatics in translational drug discovery
r1094,p1094,Review content,accepted,1,Proceedings of the 16th Annual UT-KBRIN Bioinformatics Summit 2016: bioinformatics
r1095,p1095,Review content,accepted,1,Overview of random forest methodology and practical guidance with emphasis on computational biology and bioinformatics
r1096,p1096,Review content,accepted,1,Bioinformatics for clinical next generation sequencing.
r1097,p1097,Review content,accepted,1,"Knowledge Discovery and interactive Data Mining in Bioinformatics - State-of-the-Art, future challenges and research directions"
r1098,p1098,Review content,accepted,1,An internet-based bioinformatics toolkit for plant biosecurity diagnosis and surveillance of viruses and viroids
r1099,p1099,Review content,accepted,1,Bioinformatics For Geneticists
r1100,p1100,Review content,accepted,1,Bioinformatics For Geneticists
r1101,p1101,Review content,rejected,0,Applied bioinformatics for the identification of regulatory elements
r1102,p1102,Review content,rejected,0,In the loop: promoter–enhancer interactions and bioinformatics
r1103,p1103,Review content,rejected,0,Getting Started with Microbiome Analysis: Sample Acquisition to Bioinformatics
r1104,p1104,Review content,accepted,1,Big Data Analytics in Bioinformatics: A Machine Learning Perspective
r1105,p1105,Review content,rejected,0,A selective review of robust variable selection with applications in bioinformatics
r1106,p1106,Review content,rejected,0,Design and bioinformatics analysis of genome-wide CLIP experiments
r1107,p1107,Review content,accepted,1,"EDAM: an ontology of bioinformatics operations, types of data and identifiers, topics and formats"
r1108,p1108,Review content,rejected,0,Bioinformatics programs are 31-fold over-represented among the highest impact scientific papers of the past two decades
r1109,p1109,Review content,accepted,1,"Big data analytics in bioinformatics: architectures, techniques, tools and issues"
r1110,p1110,Review content,accepted,1,Big Data Bioinformatics
r1111,p1111,Review content,accepted,1,Bioinformatics Curriculum Guidelines: Toward a Definition of Core Competencies
r1112,p1112,Review content,accepted,1,Chemo- and bioinformatics resources for in silico drug discovery from medicinal plants beyond their traditional use: a critical review.
r1113,p1113,Review content,accepted,1,From protein structure to function with bioinformatics
r1114,p1114,Review content,accepted,1,Modern bioinformatics meets traditional Chinese medicine
r1115,p1115,Review content,rejected,0,"GOBLET: The Global Organisation for Bioinformatics Learning, Education and Training"
r1116,p1116,Review content,accepted,1,Genomics Virtual Laboratory: A Practical Bioinformatics Workbench for the Cloud
r1117,p1117,Review content,accepted,1,Survey of MapReduce frame operation in bioinformatics
r1118,p1118,Review content,rejected,0,Survey of Natural Language Processing Techniques in Bioinformatics
r1119,p1119,Review content,accepted,1,Bioinformatics in Africa: The Rise of Ghana?
r1120,p1120,Review content,accepted,1,Bioinformatics Education—Perspectives and Challenges out of Africa
r1121,p1121,Review content,accepted,1,A Survey of Scholarly Literature Describing the Field of Bioinformatics Education and Bioinformatics Educational Research
r1122,p1122,Review content,accepted,1,IEEE/ACM Transactions on Computational Biology and Bioinformatics
r1123,p1123,Review content,accepted,1,Verification and validation of bioinformatics software without a gold standard: a case study of BWA and Bowtie
r1124,p1124,Review content,accepted,1,Random Forest for Bioinformatics
r1125,p1125,Review content,accepted,1,A widespread self-cleaving ribozyme class is revealed by bioinformatics
r1126,p1126,Review content,accepted,1,Challenges in RNA virus bioinformatics
r1127,p1127,Review content,accepted,1,Buying in to bioinformatics: an introduction to commercial sequence analysis software
r1128,p1128,Review content,accepted,1,MEIGO: an open-source software suite based on metaheuristics for global optimization in systems biology and bioinformatics
r1129,p1129,Review content,accepted,1,An explosion of bioinformatics careers
r1130,p1130,Review content,accepted,1,Bioinformatics: The Next Frontier of Metabolomics
r1131,p1131,Review content,accepted,1,Integration of bioinformatics to biodegradation
r1132,p1132,Review content,accepted,1,Crowdsourcing for bioinformatics
r1133,p1133,Review content,accepted,1,Flow Cytometry Bioinformatics
r1134,p1134,Review content,accepted,1,A primer to frequent itemset mining for bioinformatics
r1135,p1135,Review content,rejected,0,Influenza Research Database: an integrated bioinformatics resource for influenza research and surveillance
r1136,p1136,Review content,accepted,1,An Overview of Multiple Sequence Alignments and Cloud Computing in Bioinformatics
r1137,p1137,Review content,accepted,1,ViPR: an open bioinformatics database and analysis resource for virology research
r1138,p1138,Review content,accepted,1,Bioinformatics analysis of the epitope regions for norovirus capsid protein
r1139,p1139,Review content,accepted,1,Bioinformatics opportunities for identification and study of medicinal plants
r1140,p1140,Review content,accepted,1,Detecting the knowledge structure of bioinformatics by mining full-text collections
r1141,p1141,Review content,rejected,0,Bioinformatics: Sequence and Genome Analysis
r1142,p1142,Review content,accepted,1,Pattern Recognition in Bioinformatics
r1143,p1143,Review content,accepted,1,Computational and Bioinformatics Frameworks for Next-Generation Whole Exome and Genome Sequencing
r1144,p1144,Review content,rejected,0,ALSoD: A user‐friendly online bioinformatics tool for amyotrophic lateral sclerosis genetics
r1145,p1145,Review content,accepted,1,Role of bioinformatics and pharmacogenomics in drug discovery and development process
r1146,p1146,Review content,accepted,1,Current Challenges in the Bioinformatics of Single Cell Genomics
r1147,p1147,Review content,accepted,1,Milestones in graphical bioinformatics
r1148,p1148,Review content,accepted,1,Metscape 2 bioinformatics tool for the analysis and visualization of metabolomics and gene expression data
r1149,p1149,Review content,accepted,1,Are graph databases ready for bioinformatics?
r1150,p1150,Review content,accepted,1,Bioinformatics tools for secretome analysis.
r1151,p1151,Review content,accepted,1,Bio2RDF: Towards a mashup to build bioinformatics knowledge systems
r1152,p1152,Review content,accepted,1,Coronavirus Genomics and Bioinformatics Analysis
r1153,p1153,Review content,rejected,0,"Bioinformatics: Concepts, Methodologies, Tools, and Applications"
r1154,p1154,Review content,accepted,1,Bioinformatics Tools for Mass Spectroscopy-Based Metabolomic Data Processing and Analysis
r1155,p1155,Review content,accepted,1,Bioinformatics: Databases and Systems
r1156,p1156,Review content,accepted,1,Making it personal: translational bioinformatics
r1157,p1157,Review content,rejected,0,Computational intelligence techniques in bioinformatics
r1158,p1158,Review content,accepted,1,bioNerDS: exploring bioinformatics’ database and software use through literature mining
r1159,p1159,Review content,accepted,1,4273π: Bioinformatics education on low cost ARM hardware
r1160,p1160,Review content,accepted,1,Data mining in bioinformatics using Weka
r1161,p1161,Review content,accepted,1,The Chemistry Development Kit (CDK): An Open-Source Java Library for Chemo-and Bioinformatics
r1162,p1162,Review content,rejected,0,Cloud BioLinux: pre-configured and on-demand bioinformatics computing for the genomics community
r1163,p1163,Review content,accepted,1,A Bioinformatics Method Identifies Prominent Off-targeted Transcripts in RNAi Screens
r1164,p1164,Review content,accepted,1,An overview of the Hadoop/MapReduce/HBase framework and its current applications in bioinformatics
r1165,p1165,Review content,rejected,0,Bioinformatics clouds for big data manipulation
r1166,p1166,Review content,rejected,0,Provenance in bioinformatics workflows
r1167,p1167,Review content,rejected,0,Bioinformatics challenges for genome-wide association studies
r1168,p1168,Review content,accepted,1,Bpipe: a tool for running and managing bioinformatics pipelines
r1169,p1169,Review content,accepted,1,PATRIC: the Comprehensive Bacterial Bioinformatics Resource with a Focus on Human Pathogenic Species
r1170,p1170,Review content,accepted,1,Identification of Plasma Lipid Biomarkers for Prostate Cancer by Lipidomics and Bioinformatics
r1171,p1171,Review content,accepted,1,BioJava: an open-source framework for bioinformatics in 2012
r1172,p1172,Review content,accepted,1,A bioinformatics view of zinc enzymes.
r1173,p1173,Review content,accepted,1,The Roots of Bioinformatics in Theoretical Biology
r1174,p1174,Review content,rejected,0,Bioinformatics challenges for personalized medicine
r1175,p1175,Review content,accepted,1,Proteomics and bioinformatics approaches for identification of serum biomarkers to detect breast cancer.
r1176,p1176,Review content,accepted,1,"Probing Native Protein Structures by Chemical Cross-linking, Mass Spectrometry, and Bioinformatics*"
r1177,p1177,Review content,accepted,1,A review of the stability of feature selection techniques for bioinformatics data
r1178,p1178,Review content,rejected,0,Comprehensive Decision Tree Models in Bioinformatics
r1179,p1179,Review content,rejected,0,A Review of Ensemble Methods in Bioinformatics
r1180,p1180,Review content,accepted,1,Machine learning in bioinformatics
r1181,p1181,Review content,accepted,1,Data Mining in Bioinformatics
r1182,p1182,Review content,accepted,1,Application Of Data Mining In Bioinformatics
r1183,p1183,Review content,accepted,1,Cancer bioinformatics: A new approach to systems clinical medicine
r1184,p1184,Review content,accepted,1,Rise and Demise of Bioinformatics? Promise and Progress
r1185,p1185,Review content,accepted,1,Bioinformatics for personal genome interpretation
r1186,p1186,Review content,accepted,1,Fast Parallel Markov Clustering in Bioinformatics Using Massively Parallel Computing on GPU with CUDA and ELLPACK-R Sparse Format
r1187,p1187,Review content,accepted,1,Translational Bioinformatics: Linking the Molecular World to the Clinical World
r1188,p1188,Review content,accepted,1,CaPSID: A bioinformatics platform for computational pathogen sequence identification in human genomes and transcriptomes
r1189,p1189,Review content,accepted,1,Threshold-based feature selection techniques for high-dimensional bioinformatics data
r1190,p1190,Review content,accepted,1,myExperiment: a repository and social network for the sharing of bioinformatics workflows
r1191,p1191,Review content,accepted,1,Bioinformatics for the Human Microbiome Project
r1192,p1192,Review content,accepted,1,Advances in Omics and Bioinformatics Tools for Systems Analyses of Plant Functions
r1193,p1193,Review content,accepted,1,Personalized cloud-based bioinformatics services for research and education: use cases and the elasticHPC package
r1194,p1194,Review content,accepted,1,VectorBase: improvements to a bioinformatics resource for invertebrate vector genomics
r1195,p1195,Review content,accepted,1,Bioinformatics for High Throughput Sequencing
r1196,p1196,Review content,accepted,1,Aging and microRNA expression in human skeletal muscle: a microarray and bioinformatics analysis.
r1197,p1197,Review content,accepted,1,Principal component analysis based methods in bioinformatics studies
r1198,p1198,Review content,accepted,1,"A Bioinformatics Approach to the Identification, Classification, and Analysis of Hydroxyproline-Rich Glycoproteins[W][OA]"
r1199,p1199,Review content,accepted,1,"Pseudo Amino Acid Composition and its Applications in Bioinformatics, Proteomics and System Biology"
r1200,p1200,Review content,accepted,1,"A Bioinformatics Approach to the Identification, Classification, and Analysis of Hydroxyproline-Rich Glycoproteins[W][OA]"
r1201,p1201,Review content,rejected,0,"Pseudo Amino Acid Composition and its Applications in Bioinformatics, Proteomics and System Biology"
r1202,p1202,Review content,accepted,1,Current Protocols in Bioinformatics
r1203,p1203,Review content,accepted,1,Clinical Bioinformatics: challenges and opportunities
r1204,p1204,Review content,accepted,1,"Proteins : Structure , Function , and Bioinformatics"
r1205,p1205,Review content,accepted,1,"GProX, a User-Friendly Platform for Bioinformatics Analysis and Visualization of Quantitative Proteomics Data*"
r1206,p1206,Review content,rejected,0,International Journal of Knowledge Discovery in Bioinformatics
r1207,p1207,Review content,accepted,1,Bioinformatics and systems biology of the lipidome.
r1208,p1208,Review content,accepted,1,Multiobjective Genetic Algorithms for Clustering - Applications in Data Mining and Bioinformatics
r1209,p1209,Review content,accepted,1,Decision tree and ensemble learning algorithms with their applications in bioinformatics.
r1210,p1210,Review content,accepted,1,BioStar: An Online Question & Answer Resource for the Bioinformatics Community
r1211,p1211,Review content,rejected,0,Clinical bioinformatics: a new emerging science
r1212,p1212,Review content,rejected,0,Bioinformatics tools for cancer metabolomics
r1213,p1213,Review content,accepted,1,dbOGAP - An Integrated Bioinformatics Resource for Protein O-GlcNAcylation
r1214,p1214,Review content,rejected,0,Bioinformatics Tools and Novel Challenges in Long Non-Coding RNAs (lncRNAs) Functional Analysis
r1215,p1215,Review content,accepted,1,The use of classification trees for bioinformatics
r1216,p1216,Review content,accepted,1,Bioinformatics challenges of new sequencing technology.
r1217,p1217,Review content,accepted,1,"Omics technologies, data and bioinformatics principles."
r1218,p1218,Review content,accepted,1,Microarray bioinformatics.
r1219,p1219,Review content,accepted,1,Multimodal monitoring and neurocritical care bioinformatics
r1220,p1220,Review content,accepted,1,Using bioinformatics to predict the functional impact of SNVs
r1221,p1221,Review content,accepted,1,Tools and collaborative environments for bioinformatics research
r1222,p1222,Review content,rejected,0,Bioinformatics Resources and Tools for Phage Display
r1223,p1223,Review content,rejected,0,Translational bioinformatics: linking knowledge across biological and clinical realms
r1224,p1224,Review content,accepted,1,A Survey of Transfer and Multitask Learning in Bioinformatics
r1225,p1225,Review content,rejected,0,Role of clinical bioinformatics in the development of network-based Biomarkers
r1226,p1226,Review content,accepted,1,Mobyle: a new full web bioinformatics framework
r1227,p1227,Review content,accepted,1,The evolution of bioinformatics in toxicology: advancing toxicogenomics.
r1228,p1228,Review content,rejected,0,Comparative bioinformatics analysis of the mammalian and bacterial glycomes
r1229,p1229,Review content,accepted,1,Visual gene developer: a fully programmable bioinformatics software for synthetic gene optimization
r1230,p1230,Review content,accepted,1,Kernel Methods in Bioinformatics
r1231,p1231,Review content,accepted,1,Structural bioinformatics and its impact to biomedical science.
r1232,p1232,Review content,accepted,1,Bioinformatics analysis of disordered proteins in prokaryotes
r1233,p1233,Review content,accepted,1,Bioinformatics of the TULIP domain superfamily.
r1234,p1234,Review content,accepted,1,Systems Biology: The Next Frontier for Bioinformatics
r1235,p1235,Review content,accepted,1,BioRuby: bioinformatics software for the Ruby programming language
r1236,p1236,Review content,accepted,1,Genomics and Bioinformatics Resources for Crop Improvement
r1237,p1237,Review content,accepted,1,CloudBLAST: Combining MapReduce and Virtualization on Distributed Resources for Bioinformatics Applications
r1238,p1238,Review content,accepted,1,Detecting genomic islands using bioinformatics approaches
r1239,p1239,Review content,rejected,0,BioJava: an open-source framework for bioinformatics
r1240,p1240,Review content,accepted,1,Bioinformatics approaches for genomics and post genomics applications of next-generation sequencing
r1241,p1241,Review content,accepted,1,Combinatorial pattern discovery in biological sequences: The TEIRESIAS algorithm [published erratum appears in Bioinformatics 1998;14(2): 229]
r1242,p1242,Review content,rejected,0,PhosphoSite: A bioinformatics resource dedicated to physiological protein phosphorylation
r1243,p1243,Review content,accepted,1,Bioinformatics: the machine learning approach
r1244,p1244,Review content,accepted,1,Bioinformatics - The Machine Learning Approach
r1245,p1245,Review content,accepted,1,Bioinformatics - a practical guide to the analysis of genes and proteins
r1246,p1246,Review content,rejected,0,State of the nation in data integration for bioinformatics
r1247,p1247,Review content,rejected,0,BUSCO: assessing genome assembly and annotation completeness with single-copy orthologs
r1248,p1248,Review content,accepted,1,WIWS: a protein structure bioinformatics Web service collection
r1249,p1249,Review content,accepted,1,Trimmomatic: a flexible trimmer for Illumina sequence data
r1250,p1250,Review content,accepted,1,Probabilistic Modeling in Bioinformatics and Medical Informatics
r1251,p1251,Review content,rejected,0,Incorporating Genomics and Bioinformatics across the Life Sciences Curriculum
r1252,p1252,Review content,accepted,1,Geneious Basic: An integrated and extendable desktop software platform for the organization and analysis of sequence data
r1253,p1253,Review content,accepted,1,myGrid: personalised bioinformatics on the information grid
r1254,p1254,Review content,rejected,0,Over-optimism in bioinformatics: an illustration
r1255,p1255,Review content,accepted,1,Machine learning: an indispensable tool in bioinformatics.
r1256,p1256,Review content,accepted,1,Protein Diversity from Alternative Splicing A Challenge for Bioinformatics and Post-Genome Biology
r1257,p1257,Review content,accepted,1,"The Phyre2 web portal for protein modeling, prediction and analysis"
r1258,p1258,Review content,accepted,1,Bioinformatics and molecular modeling in glycobiology
r1259,p1259,Review content,accepted,1,Broader incorporation of bioinformatics in education: opportunities and challenges
r1260,p1260,Review content,accepted,1,"Bioinformatics training: a review of challenges, actions and support requirements"
r1261,p1261,Review content,accepted,1,Protein Bioinformatics: From Sequence to Function
r1262,p1262,Review content,accepted,1,Machine Learning Approaches to Bioinformatics
r1263,p1263,Review content,accepted,1,"MEGA5: molecular evolutionary genetics analysis using maximum likelihood, evolutionary distance, and maximum parsimony methods."
r1264,p1264,Review content,accepted,1,"DNA barcodes: Genes, genomics, and bioinformatics"
r1265,p1265,Review content,accepted,1,Complex heatmaps reveal patterns and correlations in multidimensional genomic data
r1266,p1266,Review content,accepted,1,Bioinformatics prediction of HIV coreceptor usage
r1267,p1267,Review content,accepted,1,CD-HIT: accelerated for clustering the next-generation sequencing data
r1268,p1268,Review content,accepted,1,Gene Expression Atlas at the European Bioinformatics Institute
r1269,p1269,Review content,accepted,1,"Algorithms in Bioinformatics, 5th International Workshop, WABI 2005, Mallorca, Spain, October 3-6, 2005, Proceedings"
r1270,p1270,Review content,rejected,0,The EMBL-EBI search and sequence analysis tools APIs in 2019
r1271,p1271,Review content,accepted,1,Pharmacogenomics and bioinformatics: PharmGKB.
r1272,p1272,Review content,rejected,0,Introducing EzBioCloud: a taxonomically united database of 16S rRNA gene sequences and whole-genome assemblies
r1273,p1273,Review content,rejected,0,Multiobjective Optimization in Bioinformatics and Computational Biology
